{
  "$schema": "./observations.schema.json",
  "version": 2,
  "calibrationVersion": 3,
  "updatedAt": "2026-04-27T17:05",
  "items": [
    {
      "id": "sverdlova-17-2026-04-25-23-16",
      "lat": 53.8909,
      "lng": 27.5597,
      "day": "saturday",
      "slot": "late",
      "comfortSurge": 1.96,
      "date": "2026-04-25T23:16:00",
      "address": "ул. Свердлова, 17",
      "source": "Yandex Go (mobile, screenshot)",
      "notes": "[v3 migrate manual: 1.22 → 1.96] Три замера из одной точки в 23:16: → Плеханова 42 (6.22км/10.7мин, Комфорт 22.9 ⇒ ×1.93), → Куйбышева 22 (4.03км/6.7мин, Комфорт 19.7 ⇒ ×1.97), → Рокоссовского (5.49км/9.1мин, Комфорт 20.1 ⇒ ×1.97). Среднее: ×1.96. [v2 recalc: ×1.96 → ×1.22]",
      "calibrationVersion": 3
    },
    {
      "id": "sobinova-51-2026-04-26-07-15",
      "lat": 53.9432,
      "lng": 27.5846,
      "day": "sunday",
      "slot": "morning",
      "comfortSurge": 1.32,
      "date": "2026-04-26T07:15:00",
      "address": "ул. Собинова, 51",
      "source": "Yandex Go (mobile, screenshot, IMG_9816-9819)",
      "notes": "[v3 migrate ×1.63: 0.81 → 1.32] 4 замера 07:14-07:15 на разные направления. Видимые сёрджи Комфорта: ×1.6 (→Старовиленская 7), ×2.5 (→Партизанский 156А), ×1.3 (→Белинского 11), ×2.5 (→Шаранговича 19к3). Сильная диссперсия — Yandex применяет direction-зависимый сёрдж: дальние/западные маршруты уходят с ×2.5, центральные с ×1.3-1.6. [v2 recalc: ×1.98 → ×0.81]",
      "calibrationVersion": 3
    },
    {
      "id": "pobediteley-1-2026-04-26-07-17",
      "lat": 53.9052,
      "lng": 27.5524,
      "day": "sunday",
      "slot": "morning",
      "comfortSurge": 1.45,
      "date": "2026-04-26T07:17:00",
      "address": "пр. Победителей, 1",
      "source": "Yandex Go (mobile, screenshot, IMG_9826-9831)",
      "notes": "[v3 migrate ×1.63: 0.89 → 1.45] 6 замеров 07:17-07:18 на разные направления. Сёрджи Комфорта: ×1.6 (→Шаранговича запад), ×1.0 (→Победителей 57), ×0.9 (→Энгельса), ×1.3 (→Будённого), ×1.2 (→Кальварийская), ×1.0 (→Куйбышева). Среднее ×1.17 — спокойный спрос в престижном районе. Цены ≈ surge × 10 без надбавки за км. [v2 recalc: ×1.17 → ×0.89]",
      "calibrationVersion": 3
    },
    {
      "id": "sharangovicha-79-2026-04-26-07-16",
      "lat": 53.88,
      "lng": 27.4256,
      "day": "sunday",
      "slot": "morning",
      "comfortSurge": 1.26,
      "date": "2026-04-26T07:16:00",
      "address": "ул. Шаранговича, 79А",
      "source": "Yandex Go (mobile, screenshot, IMG_9822)",
      "notes": "[v3 migrate ×1.63: 0.77 → 1.26] Дальний запад (Сухарево/Каменная горка), → Шаранговича 19к3 на 2.5км/6мин: Комфорт 8.5 @ ×0.9 (reverse-сёрдж, тариф ниже базового). Эконом ⚡ — водителей с избытком. [v2 recalc: ×0.9 → ×0.77]",
      "calibrationVersion": 3
    },
    {
      "id": "kirova-33-2026-04-26-07-16",
      "lat": 53.899,
      "lng": 27.5636,
      "day": "sunday",
      "slot": "morning",
      "comfortSurge": 1.01,
      "date": "2026-04-26T07:16:00",
      "address": "ул. Кирова, 33",
      "source": "Yandex Go (mobile, screenshot, IMG_9824)",
      "notes": "[v3 migrate ×1.63: 0.62 → 1.01] Центр у вокзала, → Шаранговича 19к3: Комфорт 17.0 @ ×1.7. Утренний пик в центре. [v2 recalc: ×1.7 → ×0.62]",
      "calibrationVersion": 3
    },
    {
      "id": "korzhenevskogo-113-2026-04-26-07-16",
      "lat": 53.846,
      "lng": 27.4996,
      "day": "sunday",
      "slot": "morning",
      "comfortSurge": 0.9,
      "date": "2026-04-26T07:16:00",
      "address": "ул. Корженевского, 113",
      "source": "Yandex Go (mobile, screenshot, IMG_9825)",
      "notes": "[v3 migrate ×1.63: 0.55 → 0.9] Курасовщина (юг), → Шаранговича 19к3 на 12км/14мин: Комфорт 16.3 @ ×1.7. Заметка 'Вы 3 в очереди' — дефицит водителей. [v2 recalc: ×1.7 → ×0.55]",
      "calibrationVersion": 3
    },
    {
      "id": "matusevicha-53-2026-04-26-07-16",
      "lat": 53.9159,
      "lng": 27.4444,
      "day": "sunday",
      "slot": "morning",
      "comfortSurge": 1.32,
      "date": "2026-04-26T07:16:00",
      "address": "ул. Матусевича, 53Б",
      "source": "Yandex Go (mobile, screenshot, IMG_9823)",
      "notes": "[v3 migrate ×1.63: 0.81 → 1.32] Запад (Каменная горка), → Шаранговича 19к3 на 4.5км/9мин: Комфорт 13 @ ×1.3. [v2 recalc: ×1.3 → ×0.81]",
      "calibrationVersion": 3
    },
    {
      "id": "voronyanskogo-15-2026-04-26-07-15",
      "lat": 53.8791,
      "lng": 27.5488,
      "day": "sunday",
      "slot": "morning",
      "comfortSurge": 0.88,
      "date": "2026-04-26T07:15:00",
      "address": "ул. Воронянского, 15к1",
      "source": "Yandex Go (mobile, screenshot, IMG_9821)",
      "notes": "[v3 migrate ×1.63: 0.54 → 0.88] Юго-центр (Грушевка), → Шаранговича 19к3 на 9км/14мин: Комфорт 14.5 @ ×1.5. [v2 recalc: ×1.5 → ×0.54]",
      "calibrationVersion": 3
    },
    {
      "id": "matusevicha-90-2026-04-26-07-26",
      "lat": 53.9167,
      "lng": 27.4378,
      "day": "sunday",
      "slot": "morning",
      "comfortSurge": 1.17,
      "date": "2026-04-26T07:26:00",
      "address": "ул. Матусевича, 90",
      "source": "Yandex Go (mobile, screenshot, IMG_9832-9834)",
      "notes": "[v3 migrate ×1.63: 0.72 → 1.17] 3 замера 07:26-07:27 на разные направления. Сёрджи Комфорта: ×1.6 (→Дунина-Марцинкевича 11, 5км СВ), ×1.6 (→Победителей 129, 8км СВ), ×2.2 (→Чюрлёниса 18, 10км Ю). Среднее ×1.80. Out-of-sample валидация формулы `cmf ≈ surge × 10`: simple-формула 4.0% ошибка vs текущая perKm=0.7 — 60.9% ошибка. [v2 recalc: ×1.8 → ×0.72]",
      "calibrationVersion": 3
    },
    {
      "id": "bogdanovicha-29-2026-04-26-07-15",
      "lat": 53.9114,
      "lng": 27.5588,
      "day": "sunday",
      "slot": "morning",
      "comfortSurge": 1.14,
      "date": "2026-04-26T07:15:00",
      "address": "ул. М. Богдановича, 29к1",
      "source": "Yandex Go (mobile, screenshot, IMG_9820)",
      "notes": "[v3 migrate ×1.63: 0.7 → 1.14] Центр-север, → Шаранговича 19к3: Комфорт 19.3 @ ×2.0. Высокий утренний спрос на запад. [v2 recalc: ×2 → ×0.7]",
      "calibrationVersion": 3
    },
    {
      "id": "speed-9816",
      "lat": 53.9432,
      "lng": 27.5846,
      "day": "sunday",
      "slot": "morning",
      "date": "2026-04-26T07:20:00",
      "hour": 7,
      "km": 5.24,
      "min": 7.7,
      "source": "historical-yandex",
      "notes": "улица Собинова 51 → Старовиленская улица 7 · 5.2км/8мин · скрин 9816",
      "calibrationVersion": 3
    },
    {
      "id": "speed-9817",
      "lat": 53.9432,
      "lng": 27.5846,
      "day": "sunday",
      "slot": "morning",
      "date": "2026-04-26T07:20:00",
      "hour": 7,
      "km": 17.64,
      "min": 18.2,
      "source": "historical-yandex",
      "notes": "улица Собинова 51 → Партизанский проспект 156 · 17.6км/18мин · скрин 9817",
      "calibrationVersion": 3
    },
    {
      "id": "speed-9818",
      "lat": 53.9432,
      "lng": 27.5846,
      "day": "sunday",
      "slot": "morning",
      "date": "2026-04-26T07:20:00",
      "hour": 7,
      "km": 3.92,
      "min": 6,
      "source": "historical-yandex",
      "notes": "улица Собинова 51 → улица Белинского 11 · 3.9км/6мин · скрин 9818",
      "calibrationVersion": 3
    },
    {
      "id": "speed-9819",
      "lat": 53.9432,
      "lng": 27.5846,
      "day": "sunday",
      "slot": "morning",
      "date": "2026-04-26T07:20:00",
      "hour": 7,
      "km": 13.49,
      "min": 20.1,
      "source": "historical-yandex",
      "notes": "улица Собинова 51 → улица Шаранговича 19 · 13.5км/20мин · скрин 9819",
      "calibrationVersion": 3
    },
    {
      "id": "speed-9824",
      "lat": 53.899,
      "lng": 27.5636,
      "day": "sunday",
      "slot": "morning",
      "date": "2026-04-26T07:20:00",
      "hour": 7,
      "km": 9.44,
      "min": 15.3,
      "source": "historical-yandex",
      "notes": "улица Кирова 33 → улица Шаранговича 19 · 9.4км/15мин · скрин 9824",
      "calibrationVersion": 3
    },
    {
      "id": "speed-9825",
      "lat": 53.846,
      "lng": 27.4996,
      "day": "sunday",
      "slot": "morning",
      "date": "2026-04-26T07:20:00",
      "hour": 7,
      "km": 12,
      "min": 14,
      "source": "historical-yandex",
      "notes": "улица Корженевского 113 → улица Шаранговича 19 · 12.0км/14мин · скрин 9825",
      "calibrationVersion": 3
    },
    {
      "id": "speed-9826",
      "lat": 53.9052,
      "lng": 27.5524,
      "day": "sunday",
      "slot": "morning",
      "date": "2026-04-26T07:20:00",
      "hour": 7,
      "km": 8.72,
      "min": 14.5,
      "source": "historical-yandex",
      "notes": "проспект Победителей 1 → улица Шаранговича 19 · 8.7км/14мин · скрин 9826",
      "calibrationVersion": 3
    },
    {
      "id": "speed-9827",
      "lat": 53.9052,
      "lng": 27.5524,
      "day": "sunday",
      "slot": "morning",
      "date": "2026-04-26T07:20:00",
      "hour": 7,
      "km": 2.74,
      "min": 4.6,
      "source": "historical-yandex",
      "notes": "проспект Победителей 1 → проспект Победителей 57 · 2.7км/5мин · скрин 9827",
      "calibrationVersion": 3
    },
    {
      "id": "speed-9828",
      "lat": 53.9052,
      "lng": 27.5524,
      "day": "sunday",
      "slot": "morning",
      "date": "2026-04-26T07:20:00",
      "hour": 7,
      "km": 1.74,
      "min": 3.6,
      "source": "historical-yandex",
      "notes": "проспект Победителей 1 → улица Энгельса 25 · 1.7км/4мин · скрин 9828",
      "calibrationVersion": 3
    },
    {
      "id": "speed-9831",
      "lat": 53.9052,
      "lng": 27.5524,
      "day": "sunday",
      "slot": "morning",
      "date": "2026-04-26T07:20:00",
      "hour": 7,
      "km": 5.97,
      "min": 10,
      "source": "historical-yandex",
      "notes": "проспект Победителей 1 → улица Будённого 16 · 6.0км/10мин · скрин 9831",
      "calibrationVersion": 3
    },
    {
      "id": "speed-9830",
      "lat": 53.9052,
      "lng": 27.5524,
      "day": "sunday",
      "slot": "morning",
      "date": "2026-04-26T07:20:00",